Headlines,Descriptions,Authors,Published_Dates,Articles,Keywords,Summaries
HIV STILL A THREAT!,HIV is real and it needs to become real to you as well. This is possible when we become vocal and educate each other about it.,,2017-12-03T13:00:04.000Z,"HIV is real and it needs to become real to you as well. This is possible when we become vocal and educate each other about it. There is great power in knowing your status!What is testing?Testing detects the presence of HIV infection in a person.Importance of testing: Knowing your status helps keep you and others safe If negative – continue taking precautions to avoid infection If positive – protect your health by talking to your healthcare provider about antiretroviral therapy It is wise to start testing from the age of 13, at least once a year Testing is free at your local clinics or testing outlets in your neighbourhoodYou have the right to: Access healthcare services Be free from unfair discrimination Enjoy privacy and confidentiality An environment that is not harmful to your health or well-beingGreat advancements are happening in the field of HIV research. Let us break the stigma by confronting stereotypes.Being HIV-positive does not stop you from living. Take control of your life by getting tested and knowing where you stand!#Countmein#plzcallme or call 083 323 1023 or email: mizzb@lovelife.org.za","['wise', 'knowing', 'real', 'hiv', 'testing', 'threat', 'wellbeinggreat', 'free', 'yeartesting', 'healthcare', 'health']","HIV is real and it needs to become real to you as well.
This is possible when we become vocal and educate each other about it.
There is great power in knowing your status!
Testing detects the presence of HIV infection in a person.
Take control of your life by getting tested and knowing where you stand!"
Kidnapped teen pregnant and HIV-positive!,A TEENAGE girl who was kidnapped and forced into marriage is now pregnant and HIV-positive!.,Yanga Soji,2017-09-07T11:48:21.000Z,"A TEENAGE girl who was kidnapped and forced into marriage is now pregnant and HIV-positive! The 17-year-old from Clarkebury, Ngcobo, near Mthatha was living with her 65-year-old gogo when she was abducted three months ago. The gogo told Daily Sun: “She didn’t come home from school one day in June. I started making a lot of calls. That was when I found out she was far away in another village. “When I phoned the family she was said to be with, a child picked up and said my granddaughter was now her brother’s wife. The next morning her uncle and I went to the cops.” After investigating, the cops tracked down the family. When they arrived at the house a young man ran out and fled. The girl then told the gogo and the cops he had forced himself on her. The girl said the man’s sister was a pupil at a local high school and had invited her to the family’s home.The gogo said after the girl was rescued she made her phone the man.“When I asked him whether he had slept with my child, he confidently declared he had slept with her the whole night without using a condom,” said the gogo. After the girl started getting pains and vomiting, the gogo took her to the clinic. Nurses ran blood tests and found the girl was pregnant and HIV-positive! Lieutenant-Colonel Mzukisi Fatyela said a warrant of arrest was out for the man and his sister.“The man will be charged with rape and human trafficking. His sister will be charged with conspiracy on these charges,” said Fatyela.","['hivpositive', 'ran', 'told', 'girl', 'man', 'teen', 'sister', 'pregnant', 'started', 'school', 'kidnapped', 'slept', 'gogo']","A TEENAGE girl who was kidnapped and forced into marriage is now pregnant and HIV-positive!
The gogo told Daily Sun: “She didn’t come home from school one day in June.
When they arrived at the house a young man ran out and fled.
After the girl started getting pains and vomiting, the gogo took her to the clinic.
Nurses ran blood tests and found the girl was pregnant and HIV-positive!"
KO LEFT SHAKEN BY HIV RUMOURS AND HATERS,"Ntokozo Mdluli, popularly known by his stage name, K.O who rose to fame with the group Teargas after releasing their critically acclaimed debut album K'shubile K'bovu in 2006.",,None,"Ntokozo Mdluli, popularly known by his stage name, K.O who rose to fame with the group Teargas after releasing their critically acclaimed debut album K'shubile K'bovu in 2006.The rapper came out with full force on a recent Instagram post saying he is tired of constant and numerous attempts to kill his music offerings and his talent.""Woke up feeling some type of way this morning. Since '16 there's been people coming for me and my work simply coz they dislike me as a person, and that has affected my morale a bit. Have been dealing wt false accusations rumors ever since I went solo. Ppl out there perpetuating lies about me out of pure hatred smh. Fake news about me having AIDS, how I released Papa Action to kill MAEs album, how I didn't want Cashtime artists to release music. How I'm an arrogant asshole, a greedy devil and spotlight hogger, how I don't appreciate my fans."" He captioned his post.He went on to say that some guy claimed he 'stole his style' just because he used the word 'Skhanda' in his music, when he'd never even heard of him and his supposed 'style'.var randomAdNumber = Math.floor((Math.random() * 50000) + 99000000);document.write(""<a href='https://pubads.g.doubleclick.net/gampad/jump?iu=0&sz=1&c=""+ randomAdNumber + ""23' target='_blank'><img src='https://pubads.g.doubleclick.net/gampad/ad?iu=0&sz=1&c=""+ randomAdNumber +""23' border='0' alt='' /></a>"");- Daily Sun","['wt', 'work', 'used', 'word', 'album', 'hiv', 'went', 'way', 'left', 'kill', 'rumours', 'shaken', 'haters', 'music', 'style']","Ntokozo Mdluli, popularly known by his stage name, K.O who rose to fame with the group Teargas after releasing their critically acclaimed debut album K'shubile K'bovu in 2006.
The rapper came out with full force on a recent Instagram post saying he is tired of constant and numerous attempts to kill his music offerings and his talent.
Have been dealing wt false accusations rumors ever since I went solo.
Fake news about me having AIDS, how I released Papa Action to kill MAEs album, how I didn't want Cashtime artists to release music.
How I'm an arrogant asshole, a greedy devil and spotlight hogger, how I don't appreciate my fans."""
TREATING HIV INFANTS IS EASY,"MEDICAL advances in the management of children living with HIV/Aids, as well as reducing the number of new HIV infections in Mzansi, have occurred with the prevention of mother-to-child transmission, a major medical success.",Sun Reporter,2018-01-17T13:30:02.000Z,"MEDICAL advances in the management of children living with HIV/Aids, as well as reducing the number of new HIV infections in Mzansi, have occurred with the prevention of mother-to-child transmission, a major medical success. Dr Julia Turner, paediatric medical advisor at Right to Care, said: “In just over 10 years, the programme, led by the department of health, has reduced HIV transmission in babies from about 30% to less than 2%.”Right to Care is a non-profit organisation that supports and delivers prevention, care and treatment services for HIV and TB. The mother-to-child programme The 28% reduction in HIV transmission in babies has been achieved by making sure that all pregnant or breastfeeding women are regularly tested for HIV. They get ARVs as soon as they are found to be HIV-positive. Babies born to HIV-positive mothers are given preventive ARVs for the first weeks of life. Birth testing and diagnosis The advances in testing allows HIV-positive infants to be diagnosed at birth and get immediate treatment. Since its introduction in 2015, birth testing has made sure that infected infants get treatment as soon as possible. Children with HIV Early ARV Therapy The Children with HIV Early Anti-retroviral Therapy study, conducted in South Africa, has shown that the likelihood of infants with HIV dying declines by 75% if they are given ARV treatment in the first 12 weeks of life.Patient database The National Health Laboratory Service runs an advanced database which identifies and provides weekly updates on all HIV-positive infants. This allows health workers to track vulnerable patients and start life-saving ARV therapy as soon as possible.Easy drug treatments Another challenge is getting babies to take the bitter-tasting drugs but scientists are also working on this challenge.","['hivpositive', 'treating', 'medical', 'transmission', 'hiv', 'testing', 'soon', 'babies', 'easy', 'infants', 'treatment', 'health']","The mother-to-child programmeThe 28% reduction in HIV transmission in babies has been achieved by making sure that all pregnant or breastfeeding women are regularly tested for HIV.
Birth testing and diagnosisThe advances in testing allows HIV-positive infants to be diagnosed at birth and get immediate treatment.
Since its introduction in 2015, birth testing has made sure that infected infants get treatment as soon as possible.
Children with HIV Early ARV TherapyThe Children with HIV Early Anti-retroviral Therapy study, conducted in South Africa, has shown that the likelihood of infants with HIV dying declines by 75% if they are given ARV treatment in the first 12 weeks of life.
Patient databaseThe National Health Laboratory Service runs an advanced database which identifies and provides weekly updates on all HIV-positive infants."
NEW HIV VACCINE COULD SAVE MILLIONS,"TODAY is World Aids Day, which aims to raise awareness about HIV and remember all those who have lost their lives to the virus.",Sifiso Jimta And Xolile Nkosi,2016-12-01T11:00:01.000Z,"TODAY is World Aids Day, which aims to raise awareness about HIV and remember all those who have lost their lives to the virus. According to the National Institute for Communicable Diseases, more than six million people are living with HIV in South Africa. Mzansi’s HIV treatment programme is the largest in the world with 3,4 million people receiving ARVs from the health department. Thanks to the institute, there might be hope on the horizon. It is involved in a large test of a HIV vaccine trial called HVTN 702 across the country. If successful, the trial will produce the world’s first HIV vaccine and save millions of lives. In KZN, the start of the trial has brought hope to community care workers across the province.Health community workers from around Durban this week attended the launch of the HVTN 702 trial at the Medical Research Council’s branch in Verulam. The trial will see the vaccine, known as RV144, being tested on 5 400 people for the next 12 months. Community health worker, Ritta Bantjies (67) from Waterloo said: “I’m excited this was launched just before the commemoration of World Aids Day. This is a reminder that we have lost many people to this virus. If this vaccine passes I’m sure we will live to see an Aids-free generation.” Dr Anamika Premrajh of the South African Medical Research Council said: “This is one of the vaccines researchers came up with after studying the particular type of HIV this country has.”","['lost', 'trial', 'save', 'workers', 'medical', 'vaccine', 'world', 'research', 'south', 'hiv', 'million', 'millions']","According to the National Institute for Communicable Diseases, more than six million people are living with HIV in South Africa.
Mzansi’s HIV treatment programme is the largest in the world with 3,4 million people receiving ARVs from the health department.
It is involved in a large test of a HIV vaccine trial called HVTN 702 across the country.
If successful, the trial will produce the world’s first HIV vaccine and save millions of lives.
The trial will see the vaccine, known as RV144, being tested on 5 400 people for the next 12 months."
HIV confession ends in death!,"WHEN Maria Sephokola confessed to her boyfriend that she had been cheating and was HIV-positive, she had no idea it would mean the end of her life.",Sipho Kekana,2015-11-18T03:00:01.000Z,"WHEN Maria Sephokola confessed to her boyfriend that she had been cheating and was HIV-positive, she had no idea it would mean the end of her life. The 25-year-old woman from Eersterust in Tshwane is lying in a mortuary today after being smashed with a hammer, allegedly by her furious lover. People said the 38-year-old man went crazy on Saturday and started hitting her all over her body.The couple had been together for four years. On Sunday morning he reportedly phoned his brother to tell him what had happened before fleeing. He was later arrested at Marikana squatter camp. Community policing forum chairman Andries Mashika said the suspect’s two brothers came to his house to tell him of the incident and he phoned the police. “We went to the house and found the man had locked his dead girlfriend in the bedroom. He had already fled the scene,” Andries said. Maria’s mum, also Maria Sephokola, told Daily Sun she had never approved of her daughter’s boyfriend. “She chose to stay with her boyfriend under the same roof even though they were not married. If she had listened to my advice she would still be alive.” Temba Police Constable Herman Moremi said: “Apparently the victim confessed to her lover that she had been cheating all the time they were together. She told him she was infected with HIV,” he said, adding that the suspect would appear in court on a murder charge.","['boyfriend', 'told', 'man', 'death', 'hiv', 'confession', 'ends', 'went', 'sephokola', 'maria', 'phoned', 'house', 'confessed', 'tell']","WHEN Maria Sephokola confessed to her boyfriend that she had been cheating and was HIV-positive, she had no idea it would mean the end of her life.
People said the 38-year-old man went crazy on Saturday and started hitting her all over her body.
“We went to the house and found the man had locked his dead girlfriend in the bedroom.
Maria’s mum, also Maria Sephokola, told Daily Sun she had never approved of her daughter’s boyfriend.
She told him she was infected with HIV,” he said, adding that the suspect would appear in court on a murder charge."
MORE OLDER PEOPLE NOW HIV-POSITIVE!,Volunteers from Small Project Foundation in Nelson Mandela Bay have been telling residents how important it is to know their HIV status.,Chris Qwazi,2017-03-27T09:02:02.000Z,"Volunteers from Small Project Foundation in Nelson Mandela Bay have been telling residents how important it is to know their HIV status.They test people for the virus in a mobile clinic.On Friday they set up their tent in front of Tshangana Clinic in New Brighton kasi, Port Elizabeth.Many people, young and old, came to be tested for HIV, high blood pressure and diabetes.Foundation volunteer Phumla Mntuyedwa said: “More older people are now testing HIV-positive.“We believe it’s because there are many sugar dads and mamas in our communities. We need to focus more on senior citizens.“We counsel and prepare victims for a new life with the virus. We tell them it is best to start ARV treatment soon. We encourage those who test negative to look after themselves and not to have risky sex.”She said they are 10 volunteers.“We use door-to-door campaigns to encourage residents to be tested even if some of them insult us.”New Brighton resident Nothemba Maqanda (41) said: “They are doing a great job. I always go for tests when I see them.”","['virus', 'hivpositive', 'volunteerswe', 'brighton', 'residents', 'hiv', 'encourage', 'tested', 'young', 'volunteers', 'older', 'test']","Volunteers from Small Project Foundation in Nelson Mandela Bay have been telling residents how important it is to know their HIV status.They test people for the virus in a mobile clinic.On Friday they set up their tent in front of Tshangana Clinic in New Brighton kasi, Port Elizabeth.Many people, young and old, came to be tested for HIV, high blood pressure and diabetes.Foundation volunteer Phumla Mntuyedwa said: “More older people are now testing HIV-positive.“We believe it’s because there are many sugar dads and mamas in our communities.
We need to focus more on senior citizens.“We counsel and prepare victims for a new life with the virus.
We tell them it is best to start ARV treatment soon.
We encourage those who test negative to look after themselves and not to have risky sex.”She said they are 10 volunteers.“We use door-to-door campaigns to encourage residents to be tested even if some of them insult us.”New Brighton resident Nothemba Maqanda (41) said: “They are doing a great job.
I always go for tests when I see them.”"
HE STOPPED TO FLIRT WITH HIV!,WHEN he was younger he wanted to make a name for himself by being a womaniser.,Godfrey Pandeka,2016-06-21T06:00:05.000Z,"WHEN he was younger he wanted to make a name for himself by being a womaniser.But 39-year-old Kelebogile Kabanyane from Jane Furse in Limpopo is today HIV-positive and the women have disappeared.He tested positive for the virus 16 years ago – on Father’s Day!The single father of three has since accepted his status and managed to change his ways. His words of advice to all the fathers in the country are to play safe, condomise every time and be faithful to their partners.Kelebogile, who came to Tembisa in Gauteng at the age of 10, said he made bad choices in life when he start sleeping around. “I could sleep with a new girlfriend for the whole week, dump her and get another one for the weekend,” he said.“I don’t want people to judge me. I just want to tell my story and maybe it can help one or two people who think having more than one partner is an achievement. My ex-girlfriend and mother of two of my children died two years after I found out I was HIV-positive.”Kelebogile decided to get tested after he got sick and lost weight. He said today he is healthy and close to God.“I don’t smoke or drink alcohol. I look after myself and make sure I eat healthy food. My children remind me to take my medication daily and give me support.”He is involved in the Treatment Action Campaign and is an educator with the Semonya Support Group. He said God helped him to accept his condition and he is not ashamed to share it with the world.“Let us be real fathers and get tested for HIV.”","['younger', 'dont', 'women', 'hiv', 'healthy', 'tested', 'fathers', 'children', 'words', 'worldlet', 'today', 'flirt', 'stopped']","WHEN he was younger he wanted to make a name for himself by being a womaniser.
But 39-year-old Kelebogile Kabanyane from Jane Furse in Limpopo is today HIV-positive and the women have disappeared.
He tested positive for the virus 16 years ago – on Father’s Day!
He said God helped him to accept his condition and he is not ashamed to share it with the world.
“Let us be real fathers and get tested for HIV.”"
Search,,,None,"MAKER OF POTENTIAL HIV CURE SPEAKS UP!News of a ""potential HIV cure"" had many on social media in a frenzy, but the maker of the drug has moved to temper expectations, saying more trials are needed, and the process is in its infancy.","['hivpositive', 'attached', 'truth', 'dating', 'hard', 'stigma', 'disease', 'challenging']",
Search,,,None,"MAKER OF POTENTIAL HIV CURE SPEAKS UP!News of a ""potential HIV cure"" had many on social media in a frenzy, but the maker of the drug has moved to temper expectations, saying more trials are needed, and the process is in its infancy.","['hivpositive', 'attached', 'truth', 'dating', 'hard', 'stigma', 'disease', 'challenging']",
‘LISTEN TO ME: TB CAN BE BEATEN’,,Sun Reporter,2018-12-01T13:30:03.000Z,"LEJWELEPUTSWA District in Free State Province lies amidthe famed goldfields.Like the rest of the country, the region is grapplingwith unemployment, poverty and the effects of the AIDS epidemic.  A group of health workers working there are determined nomore lives are needlessly lost and that rural patients receive excellentservice.Health Systems Trust Nurse Clinician Nthabeleng Lefuembodies this approach. As ‘Sister Lefu’ enters Phahameng Clinic, patientswaiting on benches hail her as an old friend. Nozmanga Dikano (36) bounds happily across to SisterLefu, saying: “Do you see how fat I am now, Sister?” Dikano was diagnosed with HIV in 2001 and was treatedwith Bactrim to prevent opportunistic infections such as pneumocystis pneumonia(PCP). In 2007 she was also diagnosed with TB and started on ART.“In 2010 I defaulted on treatment because I was workingas a domestic in Bloemfontein and my boss wouldn’t let me go to the clinic tofetch my medicine. I’m sorry to say that I defaulted for 10 years until I had ababy in 2017. “By the time they tested me in the antenatal screening,my CD4 count was at 111 ? it is supposed to be at least 350. “I already had three children and they are all HIV-negative,so they gave me Nevirapine to prevent me transmitting the virus to my babyduring childbirth.”Dikano said that after the birth she felt extremely weakand tired, unable to walk more than a few steps and struggling to even swallowwater. “I thought it was because I had had a Caesarean section.I was admitted to the provincial hospital for three weeks for low bloodpressure, because the X-rays didn’t show TB. I told the doctor that I’d had TBbefore and recognised this feeling, but he ignored me and just changed my ARVs.“I wasn’t getting better so I discharged myself and camehere to my local clinic to tell them what happened. The next day they sentSister Nthabeleng to my house to fetch me. My face was swollen like a footballand I was very dehydrated. My feet were icy cold and I couldn’t sleep at all. Ithought, ‘This is it. I am dying’.  “She examined me and said she thought it was TB, even ifit hadn’t shown up on the X-rays.”Dikano was placed on TB treatment and rapidly improved.“Within a week I was feeling much better. I have just one more month oftreatment, and my baby is on INH to prevent him contracting TB.”Dikano’s four children, ranging in age from infancy to 18years old, were so thrilled to see their mother improve that they soon joinedin ensuring that she stuck to her treatment. Dikano says that stigma around TB is in some ways worsethan the stigma of HIV. “I have been open about my HIV status for 20 years andbecause I always looked fine, no one was worried. But when I got really sickwith TB, even my own siblings wouldn’t allow me to stay with them because theywere afraid I would infect their children. They know it is highly contagiousand I think I looked so bad that it frightened them.”Now feeling as if she has a new lease on life, Dikano isa passionate advocate for education on TB and HIV: “I speak to everyone whowill listen about TB and HIV. I want to climb to the top of the mountain andtell the world that TB can be beaten.”To learn more about TB testing and treatment go tohttp://betteroffknowing.org.za/get-tested/tb/","['thought', 'tb', 'prevent', 'hiv', 'listen', 'feeling', 'sister', 'beaten', 'children', 'clinic', 'treatment', 'lefu']","As ‘Sister Lefu’ enters Phahameng Clinic, patients waiting on benches hail her as an old friend.
I was admitted to the provincial hospital for three weeks for low blood pressure, because the X-rays didn’t show TB.
“She examined me and said she thought it was TB, even if it hadn’t shown up on the X-rays.”Dikano was placed on TB treatment and rapidly improved.
They know it is highly contagious and I think I looked so bad that it frightened them.”Now feeling as if she has a new lease on life, Dikano is a passionate advocate for education on TB and HIV: “I speak to everyone who will listen about TB and HIV.
I want to climb to the top of the mountain and tell the world that TB can be beaten.”To learn more about TB testing and treatment go to http://betteroffknowing.org.za/get-tested/tb/"
Life with HIV can still be fulfilling!,PEACEFUL Kgomo’s life hit rock bottom when she tested HIV-positive last May.,Kgomotso Medupe,2016-11-03T11:02:57.000Z,"PEACEFUL Kgomo’s life hit rock bottom when she tested HIV-positive last May.The 21-year-old from Siyabuswa in Mpumalanga said when she and her friends decided to get tested, she got the shock of her life.“The nurse told me that I was HIV-positive.” Peaceful said she felt as if her life was over.“I lost all hope in life. I still don’t know how or when I got infected,” she added.Peaceful said after days of tears and sleepless nights, with the help of her family she managed to pull herself together.“I had an option: to give up on life or to take this as a challenge. My sister and her friends played a big role in helping me get back on my feet.” After the shock, Peaceful decided to reach out to other young people who are going through the same pain. “My journey made me realise that most young people in my area are ignorant when it comes to HIV/Aids and knowing their status.” Today, Peaceful holds HIV/Aids awareness campaigns in her area.“I tell my story in the hope of saving those who are HIV-negative. “I want people to be more informed about the virus and to know that being HIV-positive is not a death sentence.”","['life', 'hivpositive', 'hope', 'hiv', 'tested', 'fulfilling', 'shock', 'hivaids', 'young', 'friends', 'know', 'peaceful']","PEACEFUL Kgomo’s life hit rock bottom when she tested HIV-positive last May.
The 21-year-old from Siyabuswa in Mpumalanga said when she and her friends decided to get tested, she got the shock of her life.
“The nurse told me that I was HIV-positive.”Peaceful said she felt as if her life was over.
“I lost all hope in life.
“I had an option: to give up on life or to take this as a challenge."
