Headlines,Descriptions,Authors,Published_Dates,Articles,Keywords,Summaries
STUDENTS: SEX PAYS OUR FEES!,THEY GO to university to get an education but some still have some tough lessons to learn.,Lethabo Khambule,2017-10-06T12:00:06.000Z,"THEY GO to university to get an education but some still have some tough lessons to learn. Many young students fall into the hands of blessers.And the sell their bodies to pay their fees.This came out during a discussion group at the University of Joburg yesterday where the decriminalisation of sex work was discussed.Representatives from various government departments, NGOs and the private sector came together to exchange views and reach a decision.The discussion comes after Joburg Metro police and Emergency Services said they are not sure how to deal with magoshas when they raid buildings.This led to a discussion about students who turn to blessers and prostitution to afford food, pay their rent and afford tuition fees.Nthabiseng Ndimande, a representative from UJ’s Institutional Office for HIV/Aids, said not all students are able to afford fees or have been given bursaries.“Some students resort to prostitution or get blessers for financial gain. It is not by choice. They are trying to make ends meet and pay the rent,” she said.“This often leads to students being abused by blessers because of the financial power they have over them.”She said she met a student some time ago who was getting money from her blesser. During the course of the relationship the man made her become a magosha in order to repay him.“We ask the government to really look into this matter and when taking a decision, decide how the law will help students.”Nthabiseng said the organisation is doing its best to ensure the safety of the students.“We can’t tell them to stop if we can’t provide an alternative. They need the money and they will do it anyway.“The best we can do is to empower them with knowledge about the prevention of HIV/Aids and unwanted pregnancies.”The Institutional Office for HIV/Aids was established in 2006 and focuses mainly on student HIV and Aids programmes at the university.","['prostitution', 'rent', 'students', 'discussion', 'blessers', 'sex', 'university', 'pay', 'hivaids', 'afford', 'fees', 'student', 'pays']","Many young students fall into the hands of blessers.
This came out during a discussion group at the University of Joburg yesterday where the decriminalisation of sex work was discussed.
This led to a discussion about students who turn to blessers and prostitution to afford food, pay their rent and afford tuition fees.
Nthabiseng Ndimande, a representative from UJ’s Institutional Office for HIV/Aids, said not all students are able to afford fees or have been given bursaries.
“Some students resort to prostitution or get blessers for financial gain."
1 IN 10 DEATHS CAUSED BY BOOZE IN MZANSI!,A new study that was conducted by BMC Medicine shows that one in ten deaths in Mzansi is caused by alcohol abuse – especially those in poor areas.,Peter Matsebula,2018-07-16T12:57:53.000Z,"A new study that was conducted by BMC Medicine shows that one in ten deaths in Mzansi is caused by alcohol abuse – especially those in poor areas.The study found that overall, about 62,300 adults died from alcohol-attributable causes of death in South Africa in 2015.BMC Medicine research.It further states that nearly 60% of all alcohol-attributable deaths happened in the low socioeconomic status (SES) group.South Africa is ranked the third biggest drinking nation in the African continent a World Health Organisation’s alcohol consumption study has suggested.The study indicates that alcohol consumption in Mzansi was at 11.5 per litre, per capita for 2015, up from 11 litres the year before.This was attributed to the level of unemployment figures in the low income brackets, which in most cases leads to alcohol abuse.The study also indicates that men of middle and low SES had higher chances of dying from causes such as HIV/AIDS, tuberculosis, injuries, liver cirrhosis, or pancreatitis.“With a total of approximately 529,400 deaths from all causes, roughly one in ten deaths was attributable to alcohol use the concluded.BMC Medicine research.The researchers said there are a series of effective policy measures that can be taken up, to prevent alcohol-attributable harm such as limitations of availability and affordability of alcohol, restrictions of alcohol-marketing, and improvement of the healthcare system.They further suggested that such broad brushed measures might fail to address the causes of death found to be most relevant as well as the high risk groups identified in the current study.","['low', 'study', 'measures', 'mzansi', 'caused', 'indicates', 'alcoholattributable', 'causes', 'ses', 'booze', 'alcohol', 'deaths']","A new study that was conducted by BMC Medicine shows that one in ten deaths in Mzansi is caused by alcohol abuse – especially those in poor areas.
The study found that overall, about 62,300 adults died from alcohol-attributable causes of death in South Africa in 2015.
It further states that nearly 60% of all alcohol-attributable deaths happened in the low socioeconomic status (SES) group.
The study indicates that alcohol consumption in Mzansi was at 11.5 per litre, per capita for 2015, up from 11 litres the year before.
“With a total of approximately 529,400 deaths from all causes, roughly one in ten deaths was attributable to alcohol use the concluded."
SAFETY TIPS FOR MAGOSHAS!,"ON MONDAY the South African National Aids Council hosted its National Sex Workers symposium.   The conference was held at Turbine Hall in Newtown, Joburg.",PORTIA MOYO,2015-01-14T01:15:00.000Z,"Sex worker peer educators, from left: Adifeli Mohapi, Rose Mofokeng and Selina Makhoba from Kroonstad.         Photo by Portia MoyoSnowy Mamba, High Profile Sex Worker and Human Rights activist in South Africa and Gita November High Profile Sex Worker and Site Coordinator West Coast Red umbrella program in the Western Cape. Photo by: Portia Moyo. ON MONDAY the South African National Aids Council hosted its National Sex Workers symposium. The conference was held at Turbine Hall in Newtown, Joburg. The aim was to introduce a programme that caters to the needs of sex workers, who are more vulnerable to HIV infection than most people. Special prevention and treatment interventions suited to their particular needs and circumstances are necessary.  Deputy minister of social development Hendrietta Bogapane-Zulu said: “The aim of the programme is to reduce the transmission of HIV to sex workers and their clients.”  She added that it also aims to ensure good access to social services and healthcare for sex workers, and to tackle human rights issues such as abuse that make them vulnerable to HIV infection. The programme was introduced as a council flagship project and of the Global Fund to Fight Aids, TB and malaria.  It was financed by a grant of about R100 million from the Global Fund to Fight Aids. Council CEO Dr Fareed Abdullah said: “It not only adresses prevention of HIV and appropriate healthcare for those living with HIV, it also tackles the difficult question of access to justice for sex workers.” He said the introduction of a national HIV programme for sex workers finally plugs a gaping hole in the country’s response to the epidemic. Abdullah said about 60% of Mzansi’s estimated 150 000 sex workers are HIV-positive. “How can you talk about HIV prevention and not talk about sex work, knowing HIV transmission involves sex? “Sex workers, their non-commercial partners and their clients account for between six and 11% of all new infections in South Africa.” He said general HIV services did not meet the special needs of sex workers. “Their work exposes them to a hugely increased risk of getting infected. It is often dangerous and lonely and carries a heavy social stigma as it is illegal.” Abdullah said the programme would be initiated through a network of NGOs under the leadership of the Sex Workers Education and Advocacy task force. Kholi Buthelezi, the national co-ordinator for the national sex worker movement Sisonke said: “Our movement was formed in 2003. We were tired of being mistreated.” She said sex workers have a real stake in the planning and running of the programme.  “It is up to us to continue to organise and raise our voices louder for the changes we need to see in the legislation and policies affecting sex workers.” Buthelezi said they were doing this to protect themselves, their health, families and their futures. “We are doing something positive to fight the HIV epidemic for the nation as a whole.”","['programme', 'magoshas', 'national', 'workers', 'work', 'safety', 'needs', 'fight', 'prevention', 'hiv', 'sex', 'tips', 'social']","ON MONDAY the South African National Aids Council hosted its National Sex Workers symposium.
Abdullah said about 60% of Mzansi’s estimated 150 000 sex workers are HIV-positive.
“How can you talk about HIV prevention and not talk about sex work, knowing HIV transmission involves sex?
Kholi Buthelezi, the national co-ordinator for the national sex worker movement Sisonke said: “Our movement was formed in 2003.
We were tired of being mistreated.”She said sex workers have a real stake in the planning and running of the programme."
KAGISO TO BE CIRCUMCISED WITH 2000 MEN!,Brothers for Life ambassador Kagiso Modupe (33) has decided to get medically circumcised and is calling on 2000 men across the country to join him.,Sun Reporter,2017-02-21T12:00:16.000Z,"Brothers for Life ambassador Kagiso Modupe (33) has decided to get medically circumcised and is calling on 2000 men across the country to join him.Modupe is well loved for starring as Mangi Nyathi on the popular TV programme Scandal.“I would like South African men to join me in a celebration of masculinity, brotherhood and good health. I’m calling on men to be circumcised with me on Saturday, 11 March 2017. There are 200 clinics involved in #ZwakalaSkeem day and it’s absolutely free,” the actor said.Kagiso is encouraging men to book for a medical circumcision by sending a ‘please call me’ to 082 808 6152 to secure a slot on #ZwakalaSkeem day at one of 150 clinics in Gauteng, KZN, Mpumpalanga and the North West. “I was motivated to have this done when I read how it can protect my wife from getting Human Papillomavirus (HPV) which causes cervical cancer.  But I’ve learnt that in a recent survey of 100 000 men, 47% do it for hygiene reasons and 38% for HIV prevention. Circumcision reduces the risk of contracting HIV by 60% as well as other sexually transmitted infections. Some men do it because it keeps the penis clean, and others because their partners prefer it, but whatever the reason, it’s the right thing to do,” said ModupeKagiso will undergo the procedure at the Katlehong North Clinic.He has invited the Mini car club, a local DJ and the Ridge Riders Motorcycle Club to be there to celebrate the men who make the choice to circumcise.His wife, Liza Modupe will also take part in the celebrations.“I want it to be a chilled fun day where you can bring your wife and your kids,” he explains.When asked why he wasn’t already circumcised, Kagiso responded that he’d considered it after high school.“A doctor told me my foreskin was too small which turned out to be nonsense. Then there were the usual issues: I was nervous about the pain, the healing period and abstaining from sex. I’ve since discussed circumcision with men who have had the procedure. They say there is more discomfort than pain. Also, painkillers are provided. You can’t have sex or masturbate for six weeks afterwards, but I’ve timed it to be totally healed by my birthday.”Kagiso’s wife, Liza comments, “What he is doing is very brave. I totally support him and appreciate his decision to protect me and do the right thing.”Dr Khumbulani Moyo, Medical Male Circumcision Manager at the USAID-funded Voluntary Male Medical Circumcision consortium says: “The public health benefits are significant. One HIV infection can be prevented for every five circumcisions performed; it also reduces the risks of cervical, anal and prostate cancer. Circumcision is one of the most common procedures performed worldwide and when performed by healthcare professionals, complications are very rare.”After the circumcision, two follow up clinic visits are needed.Patients are advised to continue using condoms when having sex, to stick to one sexual partner and to know their HIV status.Any male aged 10 - 49 and in good health, irrespective of HIV status, is eligible for free circumcision in South Africa.Those under 18 need parental consent.To book an appointment for a circumcision near you on Saturday, 11 March 2017 or any other day send a ‘please call me’ to 082 808 6152 and mention #ZwakalaSkeem.","['circumcision', 'circumcised', 'medical', 'wife', 'zwakalaskeem', 'day', 'hiv', 'sex', 'kagiso', '2000', 'performed', 'men', 'male']","Brothers for Life ambassador Kagiso Modupe (33) has decided to get medically circumcised and is calling on 2000 men across the country to join him.
I’m calling on men to be circumcised with me on Saturday, 11 March 2017.
There are 200 clinics involved in #ZwakalaSkeem day and it’s absolutely free,” the actor said.
When asked why he wasn’t already circumcised, Kagiso responded that he’d considered it after high school.
I totally support him and appreciate his decision to protect me and do the right thing.”Dr Khumbulani Moyo, Medical Male Circumcision Manager at the USAID-funded Voluntary Male Medical Circumcision consortium says: “The public health benefits are significant."
STUDENTS: SEX PAYS OUR FEES!,THEY GO to university to get an education but some still have some tough lessons to learn.,,None,"THEY GO to university to get an education but some still have some tough lessons to learn. Many young students fall into the hands of blessers.And the sell their bodies to pay their fees.This came out during a discussion group at the University of Joburg yesterday where the decriminalisation of sex work was discussed.var randomAdNumber = Math.floor((Math.random() * 50000) + 99000000);document.write(""<a href='https://pubads.g.doubleclick.net/gampad/jump?iu=0&sz=1&c=""+ randomAdNumber + ""23' target='_blank'><img src='https://pubads.g.doubleclick.net/gampad/ad?iu=0&sz=1&c=""+ randomAdNumber +""23' border='0' alt='' /></a>"");Representatives from various government departments, NGOs and the private sector came together to exchange views and reach a decision.The discussion comes after Joburg Metro police and Emergency Services said they are not sure how to deal with magoshas when they raid buildings.This led to a discussion about students who turn to blessers and prostitution to afford food, pay their rent and afford tuition fees.Nthabiseng Ndimande, a representative from UJ’s Institutional Office for HIV/Aids, said not all students are able to afford fees or have been given bursaries.“Some students resort to prostitution or get blessers for financial gain. It is not by choice. They are trying to make ends meet and pay the rent,” she said.“This often leads to students being abused by blessers because of the financial power they have over them.”She said she met a student some time ago who was getting money from her blesser. During the course of the relationship the man made her become a magosha in order to repay him.“We ask the government to really look into this matter and when taking a decision, decide how the law will help students.”Nthabiseng said the organisation is doing its best to ensure the safety of the students.“We can’t tell them to stop if we can’t provide an alternative. They need the money and they will do it anyway.“The best we can do is to empower them with knowledge about the prevention of HIV/Aids and unwanted pregnancies.”The Institutional Office for HIV/Aids was established in 2006 and focuses mainly on student HIV and Aids programmes at the university.- Daily Sun","['prostitution', 'rent', 'students', 'discussion', 'blessers', 'sex', 'university', 'pay', 'hivaids', 'afford', 'fees', 'student', 'pays']","Many young students fall into the hands of blessers.
This came out during a discussion group at the University of Joburg yesterday where the decriminalisation of sex work was discussed.
This led to a discussion about students who turn to blessers and prostitution to afford food, pay their rent and afford tuition fees.
Nthabiseng Ndimande, a representative from UJ’s Institutional Office for HIV/Aids, said not all students are able to afford fees or have been given bursaries.
“Some students resort to prostitution or get blessers for financial gain."
We won’t have mercy on thieves!,"THE Department of Health in the Free State said it would deal with medicine thieves harshly.   Yesterday at Bophelo House, head of department David Motau spoke about the arrest of one of their workers who stole medicine from a Welkom clinic.",Ezekiel Morake,2015-07-15T00:00:00.000Z,"David Motau says a pharmacy assistant was arrested for stealing HIV and TB medicine.             Photo by Ezekiel Morake THE Department of Health in the Free State said it would deal with medicine thieves harshly. Yesterday at Bophelo House, head of department David Motau spoke about the arrest of one of their workers who stole medicine from a Welkom clinic. He said it was cruel of health workers to steal medicine meant for patients.  Motau said HIV and TB medicine was found at the house of a pharmacy assistant who worked at Bophelong Clinic in Welkom.  “On 9 July, we received a tip-off that there were stacks of medicine hidden in a fridge at the house of the assistant.  “The assistant has worked for the department for 10 years. She stole medicine worth R17 551. We believe she did it to enrich herself,” Motau said. He said he attended the Treatment Action Campaign’s commission recently and was appalled by the insults thrown at the department for not having sufficient medicine supplies. “We take this theft very seriously. We have been insulted as the department.  “These people are heartless and they enrich themselves by stealing from government. How do they live with themselves, knowing they have deprived sick people of medicine? We are going to deal with them ruthlessly,” Motau said. He said the 35-year-old woman had been suspended.","['medicine', 'wont', 'stole', 'motau', 'workers', 'mercy', 'department', 'worked', 'enrich', 'thieves', 'house', 'saidhe', 'health']","THE Department of Health in the Free State said it would deal with medicine thieves harshly.
Yesterday at Bophelo House, head of department David Motau spoke about the arrest of one of their workers who stole medicine from a Welkom clinic.
He said it was cruel of health workers to steal medicine meant for patients.
Motau said HIV and TB medicine was found at the house of a pharmacy assistant who worked at Bophelong Clinic in Welkom.
She stole medicine worth R17 551."
International,,,None,,"['ivory', 'forum', 'told', 'man', 'dangote', 'richest', 'look', 'nigerian', 'known', 'took']",
CRISELDA APOLOGISES TO THE GAY COMMUNITY,Metro FM personality and HIV/Aids activist Criselda Dudumashe has apologised for the offensive comments made at the University of Venda.,Channel24,2017-08-23T12:54:14.000Z,"Metro FM personality and HIV/Aids activist Criselda Dudumashe has apologised for the offensive comments made at the University of Venda. Reports claim that the media personality asked men to stand up during her address. She reportedly told people who were unsure whether to stand up to look between their legs.Her statement reads:It pains me greatly to see that a post shared on social media and my words at last week’s dialogue held at the University of Venda have upset a number of South Africans, many of whom support me on radio and others being fans throughout my career. I unreservedly apologise for the hurt my words have caused. To the many activists and victims of abuse, I realise that I have let you down. That was never my intent and for that I am deeply sorry.Given the criticism and feedback, I went back to read the posts and fully understand the anger and backlash from South Africans who expected better from me, particularly given the work I do, my own history and the position I hold as a media personality. To my employer the SABC, my colleagues and loyal listeners of my show on Metro FM I apologise for letting you down.My words came across as though I have no regard for victims and survivors of abuse. Nothing could be further from the truth!As a victim myself and a humanitarian, I strongly condemn all forms of sexual and gender based violence and believe that no one should be violated in any way. Those found guilty of abuse or any violation of human rights, should face the full might of the law.I remain committed to serving humanity and will continue to make a difference where I can.I apologize to the LGBTIQ community, everyone who attended the GBV session at the University of Venda and all South Africans for my statements.I am so sorry!CHANNEL24","['community', 'media', 'apologises', 'south', 'criselda', 'gay', 'personality', 'words', 'metro', 'university', 'africans', 'victims', 'venda', 'stand']","Metro FM personality and HIV/Aids activist Criselda Dudumashe has apologised for the offensive comments made at the University of Venda.
Reports claim that the media personality asked men to stand up during her address.
She reportedly told people who were unsure whether to stand up to look between their legs.
My words came across as though I have no regard for victims and survivors of abuse.
I apologize to the LGBTIQ community, everyone who attended the GBV session at the University of Venda and all South Africans for my statements."
Tasty condoms get a thumbs up!,"YOUNG kasi volunteers are distributing government’s new, flavoured condoms around their communities to help in the fight against HIV/Aids.",,2016-09-15 00:00:00,,"['condoms', 'thumbs', 'tasty']",
CHINESE CONDOMS TOO SMALL FOR ZIM MEN!,"Zimbabwean Health Minister David Parirenyatwa has reportedly challenged private manufactures in the country to produce condoms so as ""to address concerns over the size of condoms imported from China"".",Sun Reporter,2018-02-28T13:49:48.000Z,"Zimbabwean Health Minister David Parirenyatwa has reportedly challenged private manufactures in the country to produce condoms so as ""to address concerns over the size of condoms imported from China"".According to NewsDay, Parirenyatwa said the move would also save on foreign currency.Parirenyatwa said this while speaking during the launch of the Zimbabwe Private Sector HIV and Aids and Wellness (ZIPSHAW) co-ordinating board in the capital Harare. The minister urged private companies ""to come on board in the fight against HIV and start manufacturing drugs together with condoms, which are suitable for the Zimbabwean people"".He said that young people in the southern African country complained about the size of the imported condoms, saying that they were ""too small"". According to New Zimbabwe.com, at least 109.4 million condoms were distributed across Zimbabwe in 2016 which amounted to about 33 condoms per individual for the year.This made Zimbabwe one of the five countries that had exceeded the United Nations Population Funds regional mark of 30 male condoms per man per year, the report said.Condoms were one of the key measures that government and development partners were using to fight the HIV and Aids prevalence.https://www.news24.com/Africa/Zimbabwe/minister-says-chinese-condoms-too-small-for-zim-man-report-20180228","['zim', 'condoms', 'small', 'men', 'vote', 'chinese', '6why']",6WHY WE SHOULD VOTE!
MLUNGU MADALA'S LOOKING FOR LOVE!,Madala Michael Goldstein (63) is a lonely man.,Victor Hlungwani,2018-05-08T10:16:59.000Z,"Madala Michael Goldstein (63) is a lonely man. And after many years of searching for love without success, the desperate  Limpopo man has turned to Sun Readers forhelp .Goldstein of Dreamland on R81 between Giyani and Malamulele, is appealing to Daily Sun readers toassist him to find a woman who is ready to get married.Goldstein told Daily Sun that colour of the skin isnothing to him; he is looking anyone who is ready to stay with him no matter the race.He was born in Port Elizabeth in 1955 and moved to Johannesburgbefore he moved Giyani 25 years ago as a HIV awareness campaigner.Goldstein said he is ready to meet with any African,coloured , white or Indian woman who is ready to get married.He said he first got married in 1983 and divorced in 1989with two adopted children .He doesn’t have any idea about where are they at now.  Goldstein is said he will be able to take care of thewife as he is employed as a supervisor at Dreamland Lodge.","['woman', 'giyani', 'wife', 'white', 'moved', 'ready', 'madalas', 'love', 'goldstein', 'dreamland', 'readers', 'daily', 'mlungu', 'looking']","And after many years of searching for love without success, the desperate Limpopo man has turned to Sun Readers for help .
Goldstein told Daily Sun that colour of the skin is nothing to him; he is looking anyone who is ready to stay with him no matter the race.
He was born in Port Elizabeth in 1955 and moved to Johannesburg before he moved Giyani 25 years ago as a HIV awareness campaigner.
Goldstein said he is ready to meet with any African, coloured , white or Indian woman who is ready to get married.
Goldstein is said he will be able to take care of the wife as he is employed as a supervisor at Dreamland Lodge."
