Headlines,Descriptions,Authors,Published_Dates,Articles,Keywords,Summaries
Jol Jatra,"Giving back, one photograph at a timeAs October approached, so did Pamela Ketcher's birthday",N Anita Amreen,2015-11-15 00:00:00,"As October approached, so did Pamela Ketcher's birthday. A consultant for UNAIDS and a public health worker who's been in Bangladesh for a little over a year, her work has spanned everything from raising awareness for burning issues such as HIV as well as organising events that help social causes that are close to her heart. With October 17 marking both her birthday as well as the UN International Day for the Eradication of Poverty, this year, Ketcher had a different plan in mind.

She decided to do something a tad unorthodox – something that didn't involve the usual birthday celebration or gift exchange. An avid photographer with a passion for it, Ketcher always had a humble dream to one day hold her very own exhibition. With both her birthday and the UN day for Eradication of Poverty coincidentally falling on the same day, she decided to combine both her passion and her desire to give back to a cause by holding her very first exhibition.

Jol Jatra, a single day exhibition held at Tea Stall on November 11, had a small, but warm display of 20 photographs taken by Pamela herself, with all proceeds from the exhibition to be donated to Orunodoyer Torun Dol (OTD), a non-profit youth organisation that works relentlessly to raise awareness for social causes as well as work for the underprivileged – a cause she feels very close to.

“This exhibition is a small way for me to give back. To me it's not important to exchange gifts or celebrate my birthday this year. I wanted to do something that actually meant something to me and that's where I got the idea to hold Jol Jatra and give the proceeds to OTD.”

Despite having a range of large, and more well known organisations she could donate to, she chose to go for OTD after a serendipitous meeting with Shahidul Islam Babu, president of OTD, just two weeks prior to the exhibition.

“October was a busy month for me but I had this exhibition at the back of my mind. Interestingly, Babu turned up one day at my office and I felt like my ideas just clicked into place. His work surrounds raising awareness on social issues, public health and also working for underprivileged children – areas that I have sort of been working with. When I met him and saw the work he has put into his organisation, building it from scratch, I knew I wanted the proceeds to go OTD,” she explained.

Starting out as a group of five, OTD began it's journey in 2010, with Babu spearheading the organisation's growth one small donation at a time. Losing his parents at an early age, Babu grew up in a shabby area in Mohammadpur, only being able to study till grade four. “I remember seeing a newspaper headline that read 'Mohammadpur - a drug addicts den.' and felt tired of the misconception people had about today's youth. Soon after, I was taking a long walk one night that winter, and I noticed a woman – shriveled and cold, shivering with no blanket to shield her,” he recalled. Inspired by these two incidents, he decided to buckle up and really try to do something about. That year they were able to donate and help only three women, raising money from everyone from garment's workers to security guards who donated Tk30-Tk50 per month, a measly amount, but one that worked to humbly forward a greater cause.

“We began with five people. Today our organisation stands at 135 workers and sometimes even I'm astounded at how far we've gone. I know it isn't much in the grand scale of things, but I know we are trying our best.”

The photographs are priced between Tk2,500 to Tk3,000, depending on the size and type of photograph. With an underlying “river,” theme, each photo exhibits Pamela's excursions over the past year as she documents her time through Bangladesh, Nepal and Myanmar.

Her favourite, she says, is a top shot of long canoes with colourful seats and umbrellas pointing upwards. “It's a very colourful photo and I love colours. I call this photo 'up,' and think it's a very bright photo that just looks very happy to me,” Ketcher described.

Second in line is an almost abstract shot of a view between two boats, taken from the docks on her way to Kuakata. “When you look at this you can't really tell exactly what it is, until you look closely. It's got a very upward composition and that's what I like best,” she explained. Another, is a photograph of Banani lake, still and calm, a boat docked in the bottom with a man resting peacefully on the boat. “There was span of time when there were many hartals and I had to spend a lot of time at home. I looked out from my balcony and noticed this man, just relaxing on his boat, with the cityscape reflected in the water,” Pamela explained.

With this just being her debut exhibition, she hopes she can perhaps hold a few more. With the exhibition already underway and funds being raised, she hopes she can continue campaigning for their cause, working to help HIV cases, raise awareness on child marriage and even work for an anti-tobacco campaign. “Anything that relates to trying to minimise harm, be it for a small population or even the population at large, is something I would like to continue campaigning for,” she concluded.

Meanwhile, Babu will take the proceeds from the exhibition to fund winter clothing to be distributed among the very needy in the far north of the country. Afterwards, with the help and support of similar people and organisations, he hopes to stage a play where street children act out their stories, giving the world a glimpse into their worlds.","['day', 'babu', 'exhibition', 'proceeds', 'awareness', 'help', 'birthday', 'small', 'jol', 'jatra', 'work', 'otd']","She decided to do something a tad unorthodox – something that didn't involve the usual birthday celebration or gift exchange.
An avid photographer with a passion for it, Ketcher always had a humble dream to one day hold her very own exhibition.
“October was a busy month for me but I had this exhibition at the back of my mind.
Interestingly, Babu turned up one day at my office and I felt like my ideas just clicked into place.
His work surrounds raising awareness on social issues, public health and also working for underprivileged children – areas that I have sort of been working with."
Nobody monitors illegal blood centres,"If someone takes a stroll on the footpath opposite the Shaheed Suhrawardy Medical College Hospital in Dhaka’s Sher-e-Bangla Nagar, he will notice the phrase “blood bank” on almost every other signboard",Mohammad Jamil Khan,2015-06-13 00:00:00,"If someone takes a stroll on the footpath opposite the Shaheed Suhrawardy Medical College Hospital in Dhaka’s Sher-e-Bangla Nagar, he will notice the phrase “blood bank” on almost every other signboard.

There are scores of places in the area who “provide” blood transfusion and preservation services in the locality that is dominated by hospitals and clinics.

Hundreds of people come to these hospitals everyday and blood-related services is one of the commonest things they need.

But for a layman, who does not have medical education, there is nothing that can tell whether these blood banks have the appropriate instruments and facilities to screen out lethal germs such as HIV and Hepatitis B from a blood sample.

On government’s papers, there are only 290 licensed blood transfusion centres (BTCs) in the country. But unofficial data shows that the number of unlicensed BTCs is not less than 1,500.

The Directorate General of Health Services (DGHS) is the licensing authority but it has no monitoring responsibilities. In fact, there is no designated authority for making sure that nobody provides blood-related services without proper licenses.

Taking advantage of this loophole, thousands of blood transfusion centres are providing unsolicited services to millions of patients.

Experts say that, in most cases, the emergency patients become victims as most often blood have to be managed for them in the shortest of notices.

At present, out of the 800,000 bags of blood required in the country every year, only half comes from licensed blood banks, sources said.

The Society for Safe Blood Transfusion estimates that over 80% of the blood transfusions are unsafe as they remain unscreened.

According to the Safe Blood Transfusion Act 2002, all blood and blood products must be tested for five transfusion transmissible infections (TTIs) – Hepatitis B, Hepatitis C, syphilis, malaria and HIV. The act also says that a blood bank must recruit doctors, nurses and technicians to conduct the tests.

However, the Dhaka Tribune has learned that at most of these unlicensed blood banks, the tests are conducted by people without any relevant formal training.

Some secret blood banks in Old Dhaka, Mohammadpur and Shyamoli areas are run by gangs comprising two or three nurses and assistants who work at different hospitals.

They collect blood from drug addicts and homeless people who sell blood on a regular basis, and store it carelessly in unhygienic conditions. When any poor patient needs blood, they offer these secretly. Such banks do not have any government approval to operate.

An employee of one such blood centre in Dhaka’s Mohammadpur told this correspondent: “Patients come to us when there is an emergency. They do not bother about screening.”

He however claimed that all the blood transfusion centres in that area have proper equipment for running the blood tests.

In Dhaka’s Mohakhali area, this correspondent found a pathology centre that is set up in just two rooms – one is the reception and the other has the laboratory. This centre provides blood transfusion services as well.

Seeking anonymity, an employee of a licensed blood centre from the same locality told the Dhaka Tribune that blood screening equipment are big machines and would need several rooms.

The license fee for setting up a pathology centre is only Tk5,000 compared to the Tk1 lakh fee for a full-fledged blood transfusion centre and bank.

“That is why, many people acquire the pathology license and run blood transfusion services,” said Murad Sultan, national professional officer of the World Health Organisation (WHO).

“It is very alarming that a large number of unregulated blood banks, including many in private hospitals and clinics, are delivering blood to patients without proper screening, posing serious health risks to patients,” said Prof Dr Ashadul Islam from the Transfusion Department of the Bangabandhu Sheikh Mujib Medical University (BSMMU).

“Most of the unregulated blood banks hire a house close to public hospitals and start operating the business from there. The government does not care about monitoring the blood banks, who are involved with purchasing blood from professionals and delivering the unscreened blood to patients,” Prof Ashadul told the Dhaka Tribune.

The government is planning to set up a National Blood Centre in Mohakhali, but its construction work is yet to begin.

“The government has allocated Tk8 crore recently for the building. It will also form a central blood centre with a central database. The centre will monitor the blood banks and impart necessary training on related officials,” said Ashadul, who is also the secretary of the National Expert Council for Safe Blood Transfusion.

When contacted, State Minister for Health Zahid Malik told the Dhaka Tribune yesterday: “There is a law in this regard. There are government directives as well. We are also very serious. We are continuing action against those who do not have proper blood storing facilities or instruments. Still, despite all our efforts, one or two miss our radar. But we will most definitely take action against them as well.”","['services', 'proper', 'hospitals', 'told', 'transfusion', 'blood', 'centre', 'banks', 'centres', 'patients', 'monitors', 'illegal', 'dhaka']","On government’s papers, there are only 290 licensed blood transfusion centres (BTCs) in the country.
At present, out of the 800,000 bags of blood required in the country every year, only half comes from licensed blood banks, sources said.
The Society for Safe Blood Transfusion estimates that over 80% of the blood transfusions are unsafe as they remain unscreened.
According to the Safe Blood Transfusion Act 2002, all blood and blood products must be tested for five transfusion transmissible infections (TTIs) – Hepatitis B, Hepatitis C, syphilis, malaria and HIV.
They do not bother about screening.”He however claimed that all the blood transfusion centres in that area have proper equipment for running the blood tests."
"With half of UN goals still unmet, Bangladesh looks beyond MDGs","<br />
        	Out of the eight MDGs, Bangladesh has achieved the major targets of Goal-1, 3, 4<br />
        
        	Although Bangladesh has achieved some Millennium Development Goals (MDGs), there are some other areas including hunger and poverty reduction, employment generation, primary school completion rate and adult literacy rate that need greater attention",Tribune Desk,2013-07-08 00:00:00,"Although Bangladesh has achieved some Millennium Development Goals (MDGs), there are some other areas including hunger and poverty reduction, employment generation, primary school completion rate and adult literacy rate that need greater attention.

The areas for greater attention also include employment for women, increase in the presence of skilled health professionals at delivery, increase in correct and comprehensive knowledge on HIV/AIDS, increase in forest coverage and ICT penetration, says the “Millennium Development Goals (MDGs), Bangladesh Progress Report 2012” released Sunday.

General Economics Division (GED) of the Planning Commission launched the report at a function held in the city, reports UNB.

Planning Minister AK Khandker spoke as the chief guest while Finance Minister AMA Muhith, Food Minister M Abdur Razzaque, State Minister for Primary and Mass Education Md Motahar Hossain and UN Resident Coordinator Neal Walker also spoke.

GED member of the Planning Commission Dr Shamsul Alam presided. He highlighted the features of the report through a power-point presentation.

Out of the eight MDGs, Bangladesh has achieved the major targets of Goal-1, 3, 4 and 6 including the targets of poverty gap ratio, attaining gender parity at primary and secondary levels of education, under-five mortality rate reduction, prevention of malaria, containing HIV infection with access to antiretroviral drugs, children under-five sleeping under insecticide-treated bed nets, and detection and cure rate of TB under DOTS.

Out of 60 indicators, 34 have specific targets, against which Bangladesh already met the target in 9 indicators, 11 indicators are on track and expected to be achieved by 2015.

With less than 1,000 days remaining to the terminal year (2015) of MDGs, Bangladesh sent its proposal on Post-2015 Development Agenda to the United Nations on June 6 comprising 11 goals along with 58 targets with corresponding 241 measurable indicators in P2015DA. The implementation period for P2015DA has been proposed for 2016-2030.

Muhith said despite the country’s achievements in development indicators, still there are problems in energy security, in completion rates and standards in education, very serious problem in values as it is important in corruption and governance issues, access to technology, population pressure and degradation of environment.

Noting that there is no shortage of food in Bangladesh, Abdur Razzaque said the big challenge that Bangladesh has to face in the future is malnourishment.

Expressing his disappointment that except for some Scandinavian countries, no developed countries have come up with their commitments for helping the LDCs to meet the MDGs.

Motahar Hossain hoped that by 2015, it would be possible to enroll 95% students in primary terminal examinations. Neal Walker observed that Bangladesh made remarkable progress towards the MDGs, but this was not the time to be complacent rather to work with full spirit to attain the rest of the targets.

The report states that Bangladesh had made remarkable progress in the areas of poverty reduction, reducing the prevalence of underweight children, increasing enrolment at primary schools, lowering the infant mortality rate and maternal mortality rate, improving immunisation coverage and reducing the incidence of communicable diseases.

It said the current status of Bangladesh’s development indicates that priority needs to be given to several critical areas such as increasing productive capacity, enhancing access to knowledge and technology, strengthening trade, human and social development, improving governance and institutional capacity, increasing resilience to economic and natural shocks, mitigating climate change impacts and enhancing the volume and quality of resource support.","['report', 'areas', 'looks', 'minister', 'half', 'mdgs', 'unmet', 'targets', 'primary', 'goals', 'bangladesh', 'development', 'rate', 'indicators']","Although Bangladesh has achieved some Millennium Development Goals (MDGs), there are some other areas including hunger and poverty reduction, employment generation, primary school completion rate and adult literacy rate that need greater attention.
The areas for greater attention also include employment for women, increase in the presence of skilled health professionals at delivery, increase in correct and comprehensive knowledge on HIV/AIDS, increase in forest coverage and ICT penetration, says the “Millennium Development Goals (MDGs), Bangladesh Progress Report 2012” released Sunday.
General Economics Division (GED) of the Planning Commission launched the report at a function held in the city, reports UNB.
Out of 60 indicators, 34 have specific targets, against which Bangladesh already met the target in 9 indicators, 11 indicators are on track and expected to be achieved by 2015.
Noting that there is no shortage of food in Bangladesh, Abdur Razzaque said the big challenge that Bangladesh has to face in the future is malnourishment."
JS body for abolition of police civil units,"The parliamentary standing committee on the home ministry said the police civil unit was out to collect money from the people
        	At a meeting yesterday, a parliamentary watchdog observed that the police filed cases against thousands of unidentified people on charges of violent activities, mainly carried out by political parties, just as a means of extorting money from people",Kamran Reza Chowdhury,2013-07-25 00:00:00,"At a meeting yesterday, a parliamentary watchdog observed that the police filed cases against thousands of unidentified people on charges of violent activities, mainly carried out by political parties, just as a means of extorting money from people.

The parliamentary standing committee on the home ministry said the police civil unit was out to collect money from the people.

Police authorities at the meeting did not refute the MPs allegations but assured the watchdog that they would investigate the activities of the law enforcement agencies and take necessary action.

Jatiya Party MP and committee member Mujibul Haque raised two issues at the meeting.

“You file cases against thousands of unidentified people for violence committed by mobs. Are all people violent? Hardly 20-30 people take part in any violence,” Haque told the inspector general of police. He said the police could not issue charge sheets against thousands of people.

“Police use it as a tool of extortion. Anyone declining to give money faces charges,” said the MP. “You must stop this.”

Other members at the meeting agreed with him.

He also raised the issue of extortion of the civil units of the police.

“The civil units of the police have been involved in extortion. Please close down these units; the common people are fed up with such civil units set up at every police station,” said Haque.

He said the recent incident of extortion by the civil unit of police in Sher-e-Bangla Nagar was an example of the civil unit taking money illegally from the common people.

Police personnel arrested some members of the civil unit of the Sher-e-Bangla Nagar thana collecting money from a rickshaw puller.

The authorities will review the allegations and suggestions and take action against the persons responsible, said the inspector general.

Police officers say the civil units, whose members dress in civilian attire, have been created in every police station as a means to arrest criminals. The civilian units work in many cases to track down criminals.

Muhiuddin Khan Alamgir, the home minister, did not attend the meeting. The committee members State Minister for Home Shamsul Hoque Tuku, Sanjida Khanam and Shofiqul Islam attended the meeting led by the committee Chairman Sayedul Haque.","['js', 'extortion', 'peoplepolice', 'thousands', 'members', 'civil', 'units', 'committee', 'money', 'unit', 'body', 'abolition', 'meeting']","He also raised the issue of extortion of the civil units of the police.
“The civil units of the police have been involved in extortion.
Please close down these units; the common people are fed up with such civil units set up at every police station,” said Haque.
He said the recent incident of extortion by the civil unit of police in Sher-e-Bangla Nagar was an example of the civil unit taking money illegally from the common people.
Police officers say the civil units, whose members dress in civilian attire, have been created in every police station as a means to arrest criminals."
FM goes to Saudi Arabia today,"Foreign Minister AH Mahmood Ali is going to Saudi Arabia today on a three-day visit, Foreign Secretary M Shahidul Haque said",Sheikh Shahariar Zaman,2016-01-04 00:00:00,"Foreign Minister AH Mahmood Ali is going to Saudi Arabia today on a three-day visit, Foreign Secretary M Shahidul Haque said.

The migration issue will dominate the talks, he said.

Expatriate Welfare and Overseas Employment Secretary Khandkar Iftikhar Haider Chowdhury said an informal embargo on male workers is expected to be withdrawn.

He said the countries signed an agreement on Domestic Service Workers under which male and female workers could be sent.

Initially, Saudi Arabia was only interested in importing female domestic workers but they are now interested in widening the scope.","['domestic', 'foreign', 'today', 'secretary', 'fm', 'saudi', 'female', 'interested', 'withdrawnhe', 'workers', 'goes', 'male', 'arabia']","Foreign Minister AH Mahmood Ali is going to Saudi Arabia today on a three-day visit, Foreign Secretary M Shahidul Haque said.
The migration issue will dominate the talks, he said.
Expatriate Welfare and Overseas Employment Secretary Khandkar Iftikhar Haider Chowdhury said an informal embargo on male workers is expected to be withdrawn.
He said the countries signed an agreement on Domestic Service Workers under which male and female workers could be sent.
Initially, Saudi Arabia was only interested in importing female domestic workers but they are now interested in widening the scope."
Page not found,"All the news from Bangladesh regarding politics, business, industry, lifestyle, culture, sports, crime. The sharpest opinions and op-eds from the country.",,None,,['page'],
