Headlines,Descriptions,Authors,Published_Dates,Articles,Keywords,Summaries
Villagers bar Rabbi's burial,"The residents of Barail Polita, Magura, have not allowed the burial of alleged militant Fazle Rabbi, who was shot during police raid in Paikpara, Narayangaj",Tribune Desk,2016-08-30 00:00:00,"The residents of Barail Polita, Magura, have not allowed the burial of alleged militant Fazle Rabbi, who was shot during police raid in Paikpara, Narayangaj. Rabbi's family wanted to bury him in Magura, but the villagers stopped the move. However, Rabbi's family did not mention where his burial would take place. Rabbi is the son of Habibullah from Barail Polita. Habibullah is a teacher at a college in Jessore. The dead militant's paternal uncle, Borkat Ullah, said: “When news of Rabbi's burial broke, local residents along with freedom fighters started protesting.” Local freedom fighters Abdul Mannan, Shahadat Hossain and Khaibar Hossain said: “The militant Rabbi has tarnished the name of our village. That is why we will never let him be buried here.” Borkat Ali said, “We have decided not to bury Rabbi in Baral Polita as the villagers protested the burial.” Local Chairman Mohabbot Ali said: “Extreme tension sparked because of Rabbi's burial in Barail Polita. So, I have requested his family to not carry out the burial in the village.”","['village', 'rabbis', 'local', 'barail', 'polita', 'residents', 'villagers', 'family', 'burial', 'rabbi', 'bar']","The residents of Barail Polita, Magura, have not allowed the burial of alleged militant Fazle Rabbi, who was shot during police raid in Paikpara, Narayangaj.
Rabbi's family wanted to bury him in Magura, but the villagers stopped the move.
However, Rabbi's family did not mention where his burial would take place.
That is why we will never let him be buried here.” Borkat Ali said, “We have decided not to bury Rabbi in Baral Polita as the villagers protested the burial.” Local Chairman Mohabbot Ali said: “Extreme tension sparked because of Rabbi's burial in Barail Polita.
So, I have requested his family to not carry out the burial in the village.”"
Woof woof?,Communicating with your canine friend,Anonyo J Haque,2017-02-20 00:00:00,"“An animal’s eyes have the power to speak a great language.” ― Martin Buber Little did the Austrian-born Israeli philosopher from the 19th century know that this simple sentence would resonate so much with animal lovers out there. Not to be biased here, but if you have a dog, then you know that no truer words have ever been spoken. Whether you're in love with a great shaggy mutt or a tiny little yapster, you know that language is as important to animals as it is to us humans, especially when they're trying to convince you to give them another treat or go for another walk in the park. Having said that, while most of the time you think you're perfectly tuned to the needs of your real best friend (let's admit it, your pet is always your best friend), sometimes it can also be difficult to understand the language they're speaking. Always remember, most animals tend to utilise body language to interact, and dogs aren't an exception. Before you and your canine friend can engage in conversation for hours, there are a few things that you need to keep in mind. It is important that you observe your dog's movement, behaviour, mannerism and so forth. Learning how your pet normally behaves will allow you to know when something is wrong and respond to subtle signals of stress and unhappiness, thus avoiding more aggressive and distressed behaviour. Communication is always a two-way learning process, one where you have to transmit what you mean when you say “sit” or “no” because dogs cannot understand English. Only telling them to “sit” won't cut it since your dog won't be able to distinguish between that and all the gibberish you say around them throughout the day. However, alluring them into a sitting position and rewarding them heavily will encourage your dog to repeat the feat. Unlike popular belief, punishing your dog doesn't really help because it is proven that they don't have a great memory and are likely to forget how angry you were when they poop on your living room carpet. They may give the “guilty look” to appease you but know that he/she cannot relate that you are angry upon seeing their mess on your mom's favourite carpet from the trade fair. Giving them behavioural cues through positive reinforcements, however, might just get the job done. Rolling over and exposing the belly can be a gesture to appease you, and a belly rub would be great reinforcement for such behaviour. Mounting or humping, on the other hand, can be signs of stress especially when a dog with low-confidence dog is trying to pledge it's loyalty with a higher confidence animal. Dogs usually have a variety of gestures and signs to express their discomfort – excessive yawning or sneezing, licking of the lips, cowering, whale eye (when the whites of their eyes are showing) or a stiff body, all can indicate that your canine friend is uncomfortable. Intervene and stop anything that you are doing which can lead to a state of uneasiness. If you are trying to make your dog comfortable with something that it does not like, make sure you reward it with a lot of treats while introducing them to the uncomfortable thing slowly. The overwhelming amount of treats will motivate them to deal with it, even if they dislike it initially. Tails are another fascinating way in which dogs communicate. A wiggly butt and therefore, a wagging tail, indicate the emotion of pure joy while a slowly wagging one can mean that it is in a cautious state. On the other hand, a stiff tail shows signs of alertness and a low tail can mean that your dog is content. Lastly, a tucked tail can be evidence that your pet is scared and shows a feeling of uncertainty. Your dogs' ears can be another set of signals for you to understand when you are trying to interpret their mood. Pricked ears can be a sign that your dog is concentrating on something, curious, or engaged in play. It can also show intent, curiosity and that your dog is trying to catch sounds. Flattened ears, on the other hand, can indicate that your dog feels afraid and threatened. Ears that are close to the head and forward may also indicate aggression. Lastly, ears that are part way back but not completely flattened can also mean that your canine friend is unhappy or anxious.","['trying', 'woof', 'ears', 'indicate', 'tail', 'dog', 'know', 'language', 'friend', 'mean', 'dogs']","Not to be biased here, but if you have a dog, then you know that no truer words have ever been spoken.
A wiggly butt and therefore, a wagging tail, indicate the emotion of pure joy while a slowly wagging one can mean that it is in a cautious state.
On the other hand, a stiff tail shows signs of alertness and a low tail can mean that your dog is content.
Your dogs' ears can be another set of signals for you to understand when you are trying to interpret their mood.
Lastly, ears that are part way back but not completely flattened can also mean that your canine friend is unhappy or anxious."
Sundarbans in grave danger,"We need to stop the passage of ships through the forest, and halt so-called development projects near the Sundarbans",Kallol Mustafa,2016-03-21 00:00:00,"There is no saying when the oil slick will be removed from the water and when fish will again be found. What will happen to the livelihoods of the fishermen in this situation? Who will feed their families?

Nothing has been heard regarding relief efforts for these affected people. Who knows, perhaps the government is thinking that if it can keep the forest-dwellers starving in this manner, more of them will be motivated to use their bare hands, and their kitchen pots and pans to extract the oil and sell 30 litres each to the Padma Oil Company!

However, the people didn’t get the idea of collecting the thick layer of oil this way from the government, instead, witnessing the inaction of the government and motivated by the desire to save their beloved Sundarbans, they came up with this way of soaking up the oil themselves and storing it in polythene bags in the soil.

On observing their efforts, the government people then came up with the idea of paying them to clean up the oil in this way.

Now the question is: Is it possible to clean up the whole pollution of the Sundarbans by picking up the oil by hand in this way? Was this the only way of extracting the oil?

Who was worrying about the health risks of the ones who are using their bare hands to extract the oil? Would the members of the Forestry Department, the Secretariat of Environment, the coastguard, and the navy be willing to extract the oil with their bare hands, eschewing the use of gloves and other protective body covers?

What was the point of endangering the health of the people in order to save the health of the environment? If the oil was to be extracted in this manner, why were the people being used to do this job instead of using the various departments of the governments as well as the manpower of the armed forces?

Even if it turns out that, by taking advantage of this spontaneous effort by the people, we could extract the thick layer of oil that had collected on the banks of the waterways, what would happen to the thin layer of oil that was floating on the rivers and canals spread across an area of 80 to 100 square kilometres?

Or how would the oil be extracted that has seeped into the muddy earth which is regularly flooded by high and low tide?

There was talk of using a Chinese-made oil dispersant spray called Lloyed-2.

These chemicals are usually used to fight oil pollution on open seas. It’s not advisable to use such chemicals on mangrove wetlands without carefully considering their effects, as their application may cause even more unforeseen harm than benefits.

We spoke to Sundarbans specialist Dr Abdullah Harun from the Department of Environment at the University of Khulna about what steps should be taken to rid the Sundarbans of the oil. According to him:

First, the heavy oil that had collected in the canals have to be removed. But to achieve this, we shouldn’t depend on the spontaneous efforts of the people, but rather, employ the various governmental agencies and members of the armed forces in an organised way.

And to extract the oil, sponges and other oil absorbent material and instruments should be used in addition to using hands.

Second, before deciding to use chemical sprays to remove the floating layer of oil, we need to consider many things.

One cannot afford to lose time reaching this decision however, and the work of extracting oil using sponges and other absorbent material and vacuum machinery by the governmental agencies and members of the armed forces must begin as soon as possible.

Third, steps must be taken to extract the oil from the layer of mud that is regularly flooded by the tides, if necessary 4-5cm of soil must be extracted to achieve this.

Fourth, the oil that had collected at the base of the trees must be removed. If bare hands are used to clean the oil stuck at the base or the breathers, it may cause much damage.

The scale of danger will not become apparent right away, as we have seen from incidents of oil spills in mangrove forests in other countries in the past, it takes several weeks or even several years for the effects of the pollution to become fully manifest.

It may take a mangrove forest several decades or even half a century before it recovers.

What the Sundarbans will look like in the near future depends on the number of trees and animals that have fallen victims to the oil pollution, and also on how much of it has been affected and to what extent, and lastly, on what remedial steps are being taken.

However, the recent (lack of) actions by the government don’t give us any reason to be hopeful.

A government which has turned deaf ears to repeated requests to stop all traffic of ships carrying dangerous cargo through the Sundarbans, who, despite strong protests, is planning to build two coal-based power plants in the vicinity of the Sundarbans, the future of the Sundarbans is by no means safe in such a government’s hands.

In the face of this, the only way to free the Sundarbans of the oil, and to ensure that the passage of ships through the forest is banned in the future, and to halt so-called development projects such as the NTPC and Orion Coal Power Plant next to the Sundarbans, is to build strong public pressure on the government to do so.

This article was translated by Tibra Ali.","['bare', 'oil', 'layer', 'way', 'grave', 'extract', 'using', 'used', 'hands', 'danger', 'sundarbans', 'pollution']","Now the question is: Is it possible to clean up the whole pollution of the Sundarbans by picking up the oil by hand in this way?
Who was worrying about the health risks of the ones who are using their bare hands to extract the oil?
We spoke to Sundarbans specialist Dr Abdullah Harun from the Department of Environment at the University of Khulna about what steps should be taken to rid the Sundarbans of the oil.
And to extract the oil, sponges and other oil absorbent material and instruments should be used in addition to using hands.
If bare hands are used to clean the oil stuck at the base or the breathers, it may cause much damage."
The City,A short story,Ornob Alam,2017-09-16 00:00:00,"I wanted to sing Tagore songs again, to people who knew him. I wanted to sit idly in the periphery of all my grandaunts and their adult children as they had serious conversations I did not need to be a part of. My interest in cultures had slowly morphed into a renewed interest in my own culture

Hell was invented on a day like this. Or perhaps it was heaven. I have been told I have a negative bias. In all fairness, when faced with such unbearable heat, people probably took the escapist approach, and came up with the idea of heaven. The late morning sun shines brightly on the beautiful city of Dhaka. Beautiful because it must be. The city of dreams pushes forward with a broken grace, its brokenness endlessly pulling on romantic hearts. It functions while being oblivious to its own intricate apparatus, its lack of self-consciousness a break in the monotony of a post-modernist world. It attracts millions that do not have to be here. Or perhaps they do. In the real world, it is the industrial and commercial centre of the country with thousands of rungs for people to latch on to as they try to climb up the economic ladder. Still, I did not have to be here. I see the girl walking towards me through a cloud of dust. Dhaka’s natural sepia filter. Today is the day we decide. Leave or stay? Not just the city, but potentially each other. I am taken back to where I think it all began. I was still a hateful little teenager when I first really met her. She was smarter than me, with her dreams of technological innovation and a fulfilling life. What we shared was a desire for freedom. Which means something quite mundane in a place like Dhaka. All of that was not immediately apparent, though. “Don’t you go to my school?” she asked. “Yes.” “What were you chasing around?” “I am collecting butterflies to put them in a jar.” “Why?” “I don’t know.” My parents often told me about how Dhaka used to be a safer place, a quieter place. They had grown up playing outdoors, visiting neighbourhood friends, and going to bazaar on their own. Was it nostalgia that motivated these fond remembrances? Or were they deriving some kind of perverse pleasure from recounting them to a child who was being raised in an incubator. I am aware this is quite universal in my generation. While safety concerns here are often not ill-founded, there are other things that compromise movement and growth in this otherwise wonderful city.Conservative culture perpetuates several monstrosities. In Dhaka, it is, among other things, a constant source of reinforcing the gender barrier. I suppose women are kept safe from my lustful eyes during those partitioned milads, and me from my own lustful nature. But growing up in a setting that emphasises difference more than our common humanity, we understand each other less, and are therefore more hostile. Furthermore, people not adhering to strictly conservative standards are thought of as lesser humans, leading to the popular custom of blaming sexual harassment on the victim’s clothes or character. A culture built on the shaming of victims, a lack of trust in men’s sense of compassion, and a lot of trust in their capacity to turn into rapists -- makes it very difficult to find and hold on to love. Not because girls do not trust me, but because it largely creates the unsafe environment that it apparently warns of. In such a context, people are never free, and dreams die. By the time we were in the final year of high school, we had become good friends. She had decided on biomedical research as her calling, and was applying to biology programmes in universities in the US and Canada. Through a combination of her influence and some vague interest in viruses, I was also doing the same. I mainly wanted to leave Dhaka, but even then, I was, albeit obliviously, in love with the city. Inexplicably, but inextricably, I was part of the chaos. But for now, I would be separated from it, if only to gain more perspective. “I am never coming back to this hellhole,” I smirked. “Will you?” “I probably shouldn’t. Not much goes on in our field here. But it’s hard to say. I will miss the little habits I have developed in all these years of growing up here, the places I go to, the people I know.” “All very replaceable.” “You think so?” We were together all through our undergraduate years. It was the best time. All the freedom and spontaneity I had ever dreamed of. We could stay out as late as we wanted, and on the spur of the moment would decide on driving out to distant cities, grades and deadlines be damned. But it never affected her grades, to be honest. In our junior year, she was working in a lab that studied HIV in a mouse model. I have not forgotten to this day how HIV virions replicate after she explained it to me the night before our virology final. She had grown into an amazingly intelligent academician, even at that young age. She won research fellowships left and right, and was headed down a path of academic superstardom. I was doing something in some lab too, mostly because I felt like I had to. I had grown into a sort of culture junkie. I enjoyed the humanities more than cell biology, and was quite adept at synthesising arguments for why religion is secretly nihilistic, how Basic Instinct was a feminist take on film noir, and why the history of theatrical traditions is more reflective of a society than its chronology of leaders. All very pointless. We went to different universities for our master’s degrees. Somehow, my lack of ambition had not caught up with me yet, and I was able to breeze through a prestigious programme and immediately get a job in the city she was studying in. Her Master’s work had been so impressive that she was staying on to get a PhD at the same lab. Everything had come together nicely. But by this point I was desperate to come back to live in Dhaka. The transformation had been gradual. Aspects of my childhood to which I had never given much thought to were revealed to be important to me. I wanted to sing Tagore songs again, to people who knew him. I wanted to sit idly in the periphery of all my grandaunts and their adult children as they had serious conversations I did not need to be a part of. My interest in cultures had slowly morphed into a renewed interest in my own culture. I felt a sense of responsibility to my people. I came up with noble, but perhaps half-baked ideas and aspirations of improving public health and education in Bangladesh, and yanking the country up from its death spiral. To confound the issue, she actually understood and sympathised. I did not ask her to come back with me. She deferred the beginning of her PhD, and we came back to Bangladesh in June last year. The idea was to spend the year here, and reevaluate at the end. She found work as a lecturer at a private university, and I got a job at an NGO. Now it is time to decide, and I am no closer to having a clear answer. I have loved living here for the first time since I was a teenager. There is so much to do for entertainment and learning in the cultural sphere now, especially for someone interested in somewhat academic aspects of art, folk history, and traditional music. Last November, we were able to watch a Santali play, listen to Scottish folk musicians perform, and attend a solemn Russian piano recital, among numerous others. These were interspersed with visits to open mics where one could always expect to hear white men and women attempt Bengali songs with unabashed enthusiasm. Dhaka has truly arrived. Alongside such pointlessness, I have even found work to be quite fulfilling. More importantly, I suppose, the work feels necessary. But Dhaka is still Dhaka. Chaos gives birth to chaos. The same inhibiting environment still pervades the city and its residents. Always vaguely violent, it now directly threatens and interferes with our daily lifestyles. Our naïve brand of Arab worship has probably facilitated this degeneration into a society that produces educated militants. Further degeneration, I should say. Marriage is now a pressing need in my life, if everyone I know is to be believed. I cannot even go on overnight trips with someone I have lived with, which is an ultimately minor but strangely persistent thorn in my side. The familiar two-fingered claw of safety concerns and acceptable bhodro behaviour creeps up behind me, and pulls me back by the collar at every step. Traveling in a CNG has probably negated the positive effects of quitting cigarettes. More often than I care to think about, the boot of political influence kicks through all the rungs of the economic ladder like a great equaliser as the entire city is brought to a standstill to let one individual pass. Equal in our collective insignificance.But if chaos gives birth to chaos, what am I? What right do I have to leave? But what right do I have to stay and complicate things for someone who has been beside me for so long? In the real world, I am an individual. I owe nothing to a place or a society, but I owe something to her and myself. Should I rot in the increasingly acidic vomit of a civilisation, or move elsewhere and build a fulfilling life, whatever that may be? How bad could racial micro-aggressions in the US ever be? How bad could singing Tagore songs just for myself be?How bad could it be to not contribute to stopping the brain drain to the West? Quite bad. But not as bad as letting her leave without me. Not even as bad as living here. I smile at the girl as she emerges from the cloud like rain. The city of death relaxes its chokehold, and I breathe in some more dust.","['work', 'songs', 'interest', 'probably', 'wanted', 'city', 'dhaka', 'quite', 'bad', 'chaos']","The late morning sun shines brightly on the beautiful city of Dhaka.
The city of dreams pushes forward with a broken grace, its brokenness endlessly pulling on romantic hearts.
Not just the city, but potentially each other.
I mainly wanted to leave Dhaka, but even then, I was, albeit obliviously, in love with the city.
The city of death relaxes its chokehold, and I breathe in some more dust."
